"21337012","0","3484","12675089","Вивек\r\n\r\nПроповедь первая\r\n\r\nОн родился в пепле среди велотийцев, позднее названных каймерами, еще до войны с северными народами. Айем первой пришла в деревню нетчеводов, и тенью ей был Боэтия, Князь Интриг, и известное и неизвестное сворачивалось вокруг нее, пока не стали они похожими на звезды или послания звезд.\r\n\r\nАйем взяла жену нетчевода и сказала:\r\n\r\n«Я Ликозмеиная Королева Трех в Одном. Внутри тебя находится образ и семисложное заклинание, АЙЕМ ЭЙ СЕТИ ЭЙ ВЕК, которое ты будешь повторять, пока не явится тайна».\r\n\r\nЗатем Айем бросила жену нетчевода в океанскую воду, где дреуги отнесли ее в замки из стекла и кораллов. Они одарили жену нетчевода жабрами и млечными пальцами, изменяя ее пол так, чтобы она могла снести образ, словно яйцо. Там она провела семь или восемь месяцев.\r\n\r\nЗатем Сет пришел к жене нетчевода и сказал:\r\n\r\n«Я Заводной Король Трех в Одном. В тебе находится яйцо с моим братом-сестрой, что обладает невидимым знанием слов и мечей, и будешь ты вынашивать его до прихода Наставника».\r\n\r\nИ Сет протянул руки, и явилось сонмище гомункулов, и каждый был подобен мерцающей сквозь толщу воды веревке, и они подняли жену нетчевода на поверхность и опустили на отмели побережья Азуры. Там она лежала еще семь или восемь месяцев, заботясь о знаниях яйца путем чтения ему и Свода законов Мефалы, и пророчеств Велота, и даже запретных учений Тринимака.\r\n\r\nСемь даэдра пришли к ней однажды ночью, и каждый одарил яйцо знанием новых жестов, что могли быть достигнуты определенными движениями костей. Их называют Баронами Движения. Затем пришел восьмой даэдрот, и был он Полукнязем по имени Фа-Нуит-Хен, или Приумножателем Известных Движений.\r\n\r\nИ Фа-Нуит-Хен сказал:\r\n\r\n«Кого ты ждешь?»\r\n\r\n«Наставника», — ответила жена нетчевода.\r\n\r\n«Как пройдет три месяца, отправляйся в земли Индорил, ибо тогда начнется война. Я же теперь вернусь, дабы преследовать воинов, что пали и не знают почему. Но сначала я покажу тебе это».\r\n\r\nЗатем Бароны и Полукнязь объединились в столп стилей, ужасающий на вид, и танцевали они перед яйцом и его обучавшимся образом.\r\n\r\n«Смотри, маленький Век, и найди лицо за блеском моей снабженной лезвиями повозки, ибо в нем содержится чистый путь противоречия, идеальный во всем. Каково его число?»\r\n\r\nГоворят, что это число равно числу птиц, которые могут свить гнезда на ветвях древнего дерева тиброл, менее трех граммов честной работы, но Вивек в свои поздние годы обнаружил лучшее число и потому поделился этим секретом со своим народом.\r\n\r\n«Ибо я сокрушил мир левой рукой, — скажет он, — но в правой руке у меня — его шанс сокрушить меня. Любовь подчиняется только моей воле».\r\n\r\nКонец этих слов — АЛМСИВИ."
"21337012","0","3490","12679862","Вивек\r\n\r\nПроповедь вторая\r\n\r\nЖена нетчевода, носившая в себе яйцо Вивека, отправилась искать земли Индорил. Во время путешествия многие духи навещали ее и предлагали наставления для ее сына-дочери, в будущем славного и незримого воина-поэта Вварденфелла, Вивека.\r\n\r\nПервый дух раскинул руки вокруг нее и крепко обнял свое знание. Жена нетчевода вымокла в Неисчислимом Усилии. Яйцо было восхищено и начало кувыркаться в ней, кланяясь пяти углам мира и приговаривая:\r\n\r\n«Таким образом, каждый, кто совершает это священное действие, должен быть самым гордым и могущественным среди всех остальных!»\r\n\r\nВторой дух был слишком надменным и очень много о себе мнил, и потому был изгнан заклинанием головной боли. Третий дух, Ат-Хатур, пришел к жене нетчевода, когда она отдыхала под императорским зонтичным грибом. Одеяния этого духа были сотканы из последствий смыслов, и яйцо три раза взглянуло на них.\r\n\r\nВ первый раз Вивек сказал:\r\n\r\n«Ха, это ничего не значит!»\r\n\r\nВзглянув второй раз, он сказал:\r\n\r\n«Хм, там все-таки может что-то быть».\r\n\r\nВ конце концов, бросив на облачение Ат-Хатура взгляд искоса, он сказал:\r\n\r\n«Удивительна способность делать вывод о значении чего-то, лишенного деталей!»\r\n\r\n«И это иносказание», — отметил Ат-Хатур, и затем он ушел.\r\n\r\nЧетвертый дух пришел вместе с пятым, ибо они были кузенами. Они смогли призрачно коснуться яйца и проникнуть в него, пытаясь найти суть. Некоторые говорят, что тогда Вивек своей формой напоминал звезду, чья полутень была разорвана; другие считают, что он был похож на возрождение исчезнувших форм.\r\n\r\n«Со своей стороны семьи, — сказал первый кузен, — я принес тебе ряд стихийных бедствий, которые станут причиной конца света».\r\n\r\n«А с моей стороны, — сказал второй кузен, — я принес тебе все первозданные слияния, которые будут сопровождать эти несчастья».\r\n\r\nТут яйцо рассмеялось: «Я слишком многим одарен, и это бремя непосильно для юного меня. Мне следовало бы родиться до этого».\r\n\r\nИ затем появился шестой дух, Мефала Черные Руки, что с первого дня сотворения мира обучала велотийцев искусству секса и убийства. Горящее сердце этого духа растопило глаза жены нетчевода и извлекло яйцо из ее живота, сделав шесть надрезов. Яйцо-образ, однако, смогло заглянуть в древние времена, когда земля еще остывала и не была ослеплена.\r\n\r\nОно соединилось с даэдротом и забрало ее тайны, оставив несколько, чтобы сеть мира оставалась крепкой. Тогда Мефала Черные Руки вернула яйцо обратно в жену нетчевода и стала дуть на нее магическим дыханием, пока разрез не затянулся. Но даэдрот не вернула ей зрение, сказав:\r\n\r\n«У бога три ключа есть: рождения, машин и слов промежуточных».\r\n\r\nВ этой проповеди мудрый найдет половину из этих ключей.\r\n\r\nКонец этих слов — АЛМСИВИ."
"21337012","0","3491","12684748","Вивек\r\n\r\nПроповедь третья\r\n\r\nПо пути во владения дома Индорил жена нетчевода, будучи слепой, забрела в пещеру. И случилось так, что та пещера была двемерской твердыней. Двемеры прознали о яйце и захватили жену нетчевода. Они привязали ее голову к ногам и утащили ее глубоко в недра земли.\r\n\r\nОна услышала, как один из них сказал:\r\n\r\n«Ступай и сделай ее имитацию, и верни ее на поверхность, чтобы она там была. Ибо у нее есть что-то схожее с тем, что есть у нас, и потому велотийцы будут жаждать этого и заметят, если ее долго не будет».\r\n\r\nВо тьме жена нетчевода почувствовала, что большие ножи пытаются взрезать ее. Когда же ножи не сработали, двемеры использовали непрерывные звуки. Когда же и это не помогло, они раздули сильный жар. Однако ничего не помогало, и яйцо Вивека осталось в безопасности внутри нее.\r\n\r\nОдин двемер сказал:\r\n\r\n«Результат не был достигнут. Ничто не помогло. Мы должны продолжить и неправильно истолковать это».\r\n\r\nВивек почувствовал, что его мать испугана, и потому успокоил ее.\r\n\r\n«Огонь мой, да поглотит он тебя\r\nИ соорудит тайную дверь\r\nНа алтаре Падхоума\r\nВ Доме Боэт-и-И,\r\nГде мы будем в безопасности\r\nИ окружены заботой».\r\n\r\nЭта старая молитва заставила жену нетчевода улыбнуться, и она погрузилась в сон столь глубокий, что, когда вернулись двемерские атронахи с угловатыми сферами и разрезали ее на части, она не проснулась и мирно скончалась. Вивека вынули из ее утробы и поместили в контейнер из магического стекла для дальнейшего изучения. Чтобы сбить с толку своих пленителей, он направил свою сущность в любовь — эмоцию, о которой двемеры ничего не знали.\r\n\r\nЯйцо сказало:\r\n\r\n«Любовь используется не только как составляющая настроений и любовных связей, но также и как сырье, из которого отношения впоследствии производят раздражения, досадно сложенные ограничения, загадки, приправленные привязанностями, знакомыми лишь влюбленной паре, и взгляды, что задерживаются слишком долго.\r\n\r\nЛюбовь также — часто используемый ингредиент некоторых откровенных словесных и бессловесных действий, в которых со временем она также может быть обращена в многообразие истинных преданностей, некоторые из которых образуют крепкие, нерушимые и неплавкие союзы. В своей исходной форме любовь обеспечивает приблизительно тринадцать частей всей энергии, извлекаемой из отношений. Ее роль и ценность в обществе в целом сомнительна».\r\n\r\nЭти слова раздражали двемеров, и они попытались спрятаться за своими символами власти. Они послали своих атронахов вынести образ яйца из пещеры и поместить его в созданную ими имитацию матери Вивека.\r\n\r\nОдин двемер сказал:\r\n\r\n«Мы, двемеры, лишь претенденты на то, что есть у велотийцев».\r\n\r\nОни будут нашей погибелью в этом и восьми известных мирах, чьи имена НИРН, ЛХАН, РКЕТ, ТЕНДР, КИНРТ, АКАТ, МАРА и ДЖУНАЛ.\r\n\r\nВ этой проповеди — тайна погибели.\r\n\r\nКонец этих слов — АЛМСИВИ."
"21337012","0","3492","12689867","Вивек\r\n\r\nПроповедь четвертая\r\n\r\nИмитация жены нетчевода, несшая в себе яйцо Вивека, вернулась к поиску земель Индорил. По пути ее навещали множество других духов, предлагая наставления для ее сына-дочери, в будущем славного незримого воина-поэта Вварденфелла, Вивека.\r\n\r\nПоказалась труппа духов, называемых Лоббистами Гильдии Совпадения. Вивек немедленно понял, в чем вызов, и сказал:\r\n\r\n«Популярное представление о боге убивает стечение обстоятельств».\r\n\r\nПредводитель Лоббистов, чье имя забыто, попытался защитить бытие концепции. Он сказал: «Одновременное произнесение чего-либо может иметь магическую природу».\r\n\r\nВивек знал, что для сохранения своей божественности он должен выдвинуть убедительный довод против удачи. И он сказал:\r\n\r\n«Разве не является внезапное раскрытие соответствующих условий и несопоставимых элементов, сливающихся в момент случайного стечения обстоятельств в одну из предпосылок бытия, по сути, случайным? Синхронность происходит из многократных случайных стечений обстоятельств на низшем уровне. Дальнейшее же исследование показывает, что именно довлеющая сила огромного числа случайных стечений обстоятельств приводит наблюдателя к мысли, будто синхронность управляется чем-то большим, нежели случай. Следовательно, синхронность завершается, аннулируя концепцию случайности, даже при том, что они обе являются симптоматически проявляющимися признаками».\r\n\r\nТаким образом в землях велотийцев было уничтожено случайное стечение обстоятельств.\r\n\r\nЗатем перед имитацией жены нетчевода из земли вылезла Старая Кость и сказала: «Если ты рожден правящим королем мира, ты должен спутать его новыми словами. Посвяти меня в размышления».\r\n\r\n«Хорошо, — сказал Вивек. — Давай я расскажу тебе о мире, который я делю с тайной и любовью. Кто является его столицей? Проследила ли ты театральный путь его эпизодических ролей? Я — да, слегка, втайне, при отсутствии свечей, ибо они на неверной стороне, и я провел рукой по краю тени, сотканной из ста и трех категорий теплоты, и не оставил никаких улик».\r\n\r\nПри этих словах Старая Кость изогнулась к себе двадцать раз кряду, пока не стала подобна молоку, кое Вивек и выпил, став правящим королем мира.\r\n\r\nИ, наконец, явился Канцлер Точности, являвший собою совершенство под любым углом зрения. Вивек немедленно понял, в чем вызов, и сказал:\r\n\r\n«Убежденность — удел логиков из шкатулок-головоломок и девиц с ореолом непорочного обаяния, которые накапливают его в собственное свободное время. Я же — письмо, написанное в неопределенности».\r\n\r\nКанцлер склонил голову и улыбнулся пятьюдесятью различными и совершенными способами одновременно. Он извлек из мантии астролябию вселенной, разломил ее надвое и вручил обе половинки яйцу-образу Вивека. Вивек рассмеялся и сказал:\r\n\r\n«Да, я знаю. Рабский труд чувств эгоистичен, как полярный лед, и все ухудшается, когда энергии растрачены на жизнь, кою иные почитают счастливой. Чтобы быть правящим королем, мне придется выстрадать многое из того, что выстрадать нельзя, и также взвесить вещи, что не измерить никакими астролябиями или компасами».\r\n\r\nКонец этих слов — АЛМСИВИ."
"21337012","0","3493","12695482","Вивек\r\n\r\nПроповедь пятая\r\n\r\nВ конце концов имитация жены нетчевода стала нестабильной. Двемеры спешили и создали ее некачественной, и пепел Красной горы ослабил ее золотые сухожилия. Вскоре имитация упала на колени у дороги к землям Индорил и осталась лежать там, опрокинувшись; через восемьдесят дней ее обнаружил торговый караван по пути в столицу велотийцев, позднее названную Алмалексией.\r\n\r\nВивек не был среди своего народа все дни своей пре-жизни, и потому он молчал и позволил каймерам из каравана думать, что имитация сломана и пуста. Каймер-воин, что защищал тот караван, сказал:\r\n\r\n«Смотрите, как эти двемеры снова пытаются обмануть нас, создавая наши подобия из своих металлов, подобных плоти. Мы должны взять это с собой в столицу и показать нашей матери, Айем. Ей захочется увидеть эту новую стратегию наших врагов».\r\n\r\nНо главный торговец возразил:\r\n\r\n«Я сомневаюсь, что нам хорошо заплатят за это. Наша выгода будет больше, если мы остановимся в Нурмоке и продадим его Красным Женам Дагона, кои хорошо платят за чудеса, созданные народом глубин».\r\n\r\nНо другой каймер, что был мудр и знал пути пророчеств, смотрел на имитацию с тревогой:\r\n\r\n«Не для того ли вы меня наняли, чтобы я нашел для вас лучшую из судеб? Говорю вам, послушайте своего воина и отнесите эту вещь Айем, ибо, хоть и изготовлена она нашими врагами, нечто в ней будет священным — или уже стало таковым».\r\n\r\nГлавный торговец задумался, глядя на имитацию жены нетчевода, и, несмотря на то, что он всегда прислушивался к советам своих провидцев, он не мог думать ни о чем ином, кроме тех денег, которые можно получить в Нурмоке. В основном он думал о том вознаграждении, что дадут ему Красные Жены, четырехугольном и хорошо израненном, о магии живота, неизвестной нигде более под лунами. Похоть заставила его забыть о своей матери Айем. И он приказал сменить курс и идти в Нурмок.\r\n\r\nНо не успел караван снова тронуться в путь, как каймер-воин, который предлагал идти в столицу, бросил свои деньги в главного торговца и сказал:\r\n\r\n«Раз никаким словом тебя не убедить, я заплачу этим тебе за имитацию и предупреждаю: грядет война с лохматыми людьми севера, и я не позволю моей матери Айем оказаться в невыгодном положении по отношению к одному врагу, пока она разбирается с другим».\r\n\r\n«Неревар, — ответил главный торговец, — этого недостаточно. Я Триедин по-своему, но следую по пути своего тела и требую большего».\r\n\r\nИ тогда Вивек не смог дальше молчать и произнес в голове Неревара такие слова:\r\n\r\n«Словам моим внемли и прочь беги,\r\nВ неведомое ты, Наставник, сам направлен.\r\nПока во дне вчерашнем не поспишь — молчи,\r\nИ не пиши элегий камню, что расплавлен».\r\n\r\nИ Неревар сразил главного торговца и сам возглавил караван.\r\n\r\nКонец этих слов — АЛМСИВИ."
